<hybrisconfig xmlns:xsi='http://www.w3.org/2001/XMLSchema-instance' xsi:noNamespaceSchemaLocation='../bin/platform/resources/schemas/extensions.xsd'>
  <extensions>



    <path dir='${HYBRIS_BIN_DIR}' autoload='false' />
    <extension name='adaptivesearch' />
    <extension name='adaptivesearchbackoffice' />
    <extension name='adaptivesearchfacades' />
    <extension name='adaptivesearchsolr' />
    <extension name='adaptivesearchwebservices' />
    <extension name='apiregistrybackoffice' />
    <extension name='apiregistryservices' />
    <extension name='assistedservicecustomerinterestsfacades' />
    <extension name='assistedservicefacades' />
    <extension name='assistedservicepromotionfacades' />
    <extension name='assistedserviceservices' />
    <extension name='assistedservicewebservices' />
    <extension name='assistedserviceyprofilefacades' />
    <extension name='yaasyprofileconnect' />
    <extension name='b2bacceleratorbackoffice' />
    <extension name='b2bacceleratorfacades' />
    <extension name='b2bacceleratorservices' />
    <extension name='b2bocc' />
    <extension name='b2bocctests' />
    <extension name='b2bwebservicescommons' />
    <extension name='powertoolsstore' />
    <extension name='savedorderforms' />
    <extension name='savedorderformsocc' />
    <extension name='b2bapprovalprocess' />
    <extension name='b2bapprovalprocessfacades' />
    <extension name='b2bcommerce' />
    <extension name='b2bcommercebackoffice' />
    <extension name='b2bcommercefacades' />
    <extension name='b2bpunchout' />
    <extension name='b2bpunchoutbackoffice' />
    <extension name='b2bpunchoutocc' />
    <extension name='b2bpunchoutocctests' />
    <extension name='apparelstore' />
    <extension name='electronicsstore' />
    <extension name='wishlist' />
    <extension name='wishlistfacades' />    
    <extension name='classificationgroupsservices' />
    <extension name='mediaconversionbackoffice' />
    <extension name='patchesbackoffice' />
    <extension name='pcmbackoffice' />
    <extension name='backoffice' />
    <extension name='platformbackoffice' />
    <extension name='ybackoffice' />
    <extension name='yacceleratorbackoffice' />
    <extension name='yacceleratorcore' />
    <extension name='yacceleratorfacades' />
    <extension name='yacceleratorinitialdata' />
    <extension name='yacceleratorstorefront' />
    <extension name='basecommerce' />
    <extension name='basecommercebackoffice' />
    <extension name='customerreview' />
    <extension name='payment' />
    <extension name='promotions' />
    <extension name='promotionsbackoffice' />
    <extension name='voucher' />
    <extension name='voucherbackoffice' />
    <extension name='profileservices' />
    <extension name='merchandisingcmswebservices' />
    <extension name='merchandisingservices' />
    <extension name='merchandisingservicesbackoffice' />
    <extension name='merchandisingsmartedit' />
    <extension name='chinesecommercewebservicescommons' />
    <extension name='chineseaddressbackoffice' />
    <extension name='chineseaddressfacades' />
    <extension name='chineseaddressocc' />
    <extension name='chineseaddressocctests' />    
    <extension name='chineseaddressservices' />
    <extension name='chinesecommerceorgaddressfacades' />
    <extension name='commercefacades' />
    <extension name='commerceservices' />
    <extension name='commerceservicesbackoffice' />
    <extension name='commercewebservices' />
    <extension name='commercewebservicescommons' />
    <extension name='commercewebservicestests' />
    <extension name='yocc' />
    <extension name='yocctests' />
    <extension name='configurablebundlebackoffice' />
    <extension name='configurablebundlefacades' />
    <extension name='configurablebundleocc' />
    <extension name='configurablebundleocctests' />
    <extension name='configurablebundleservices' />
    <extension name='sapproductconfigb2bservices' />
    <extension name='sapproductconfigfacades' />
    <extension name='sapproductconfigocc' />
    <extension name='sapproductconfigocctests' />
    <extension name='sapproductconfigrules' />
    <extension name='sapproductconfigrulesbackoffice' />
    <extension name='sapproductconfigruntimeinterface' />
    <extension name='sapproductconfigruntimemock' />
    <extension name='sapproductconfigservices' />
    <extension name='consignmenttrackingbackoffice' />
    <extension name='consignmenttrackingfacades' />
    <extension name='consignmenttrackingmock' />
    <extension name='consignmenttrackingocc' />
    <extension name='consignmenttrackingservices' />
    <extension name='acceleratorbackoffice' />
    <extension name='acceleratorcms' />
    <extension name='acceleratorfacades' />
    <extension name='acceleratorocc' />
    <extension name='acceleratorservices' />
    <extension name='couponbackoffice' />
    <extension name='couponfacades' />
    <extension name='couponservices' />
    <extension name='couponwebservices' />
    <extension name='customercouponbackoffice' />
    <extension name='customercouponfacades' />
    <extension name='customercouponocc' />
    <extension name='customercouponservices' />
    <extension name='customerinterestsfacades' />
    <extension name='customerinterestsocc' />
    <extension name='customerinterestsservices' />
    <extension name='customersupportbackoffice' />
    <extension name='customerticketingfacades' />
    <extension name='customerticketingocc' />
    <extension name='customerticketingocctests' />
    <extension name='ticketsystem' />
    <extension name='ticketsystembackoffice' />
    <extension name='datahubadapter' />
    <extension name='datahubclient' />
    <extension name='dataimportcommons' />
    <extension name='entitlementbackoffice' />
    <extension name='entitlementfacades' />
    <extension name='entitlementservices' />
    <extension name='inboundservices' />
    <extension name='integrationbackoffice' />
    <extension name='integrationbackofficetest' />
    <extension name='integrationmonitoringbackoffice' />
    <extension name='integrationservices' />
    <extension name='odata2services' />
    <extension name='odata2webservices' />
    <extension name='outboundservices' />
    <extension name='outboundsync' />
    <extension name='outboundsyncbackoffice' />
    <extension name='webhookbackoffice' />
    <extension name='webhookservices' />
    <extension name='messagecentercsfacades' />
    <extension name='messagecentercsocc' />
    <extension name='messagecentercsservices' />
    <extension name='notificationfacades' />
    <extension name='notificationocc' />
    <extension name='notificationservices' />
    <extension name='npmancillary' />
    <extension name='b2bordermanagementfacades' />
    <extension name='b2bordermanagementwebservices' />
    <extension name='ordermanagementfacades' />
    <extension name='ordermanagementwebservices' />
    <extension name='warehousing' />
    <extension name='warehousingbackoffice' />
    <extension name='warehousingfacades' />
    <extension name='warehousingwebservices' />
    <extension name='yacceleratorordermanagement' />
    <extension name='personalizationcms' />
    <extension name='personalizationcmsbackoffice' />
    <extension name='personalizationcmsweb' />
    <extension name='personalizationfacades' />
    <extension name='personalizationintegration' />
    <extension name='personalizationintegrationbackoffice' />
    <extension name='personalizationservices' />
    <extension name='personalizationservicesbackoffice' />
    <extension name='personalizationsmartedit' />
    <extension name='personalizationwebservices' />
    <extension name='previewpersonalizationweb' />
    <extension name='personalizationyprofile' />
    <extension name='personalizationpromotions' />
    <extension name='personalizationpromotionsbackoffice' />
    <extension name='personalizationpromotionssmartedit' />
    <extension name='personalizationpromotionsweb' />
    <extension name='personalizationsearch' />
    <extension name='personalizationsearchbackoffice' />
    <extension name='personalizationsearchsmartedit' />
    <extension name='personalizationsearchweb' />
    <extension name='adminapi' />
    <extension name='alluicommons' />
    <extension name='auditreportservices' />
    <extension name='azuredtu' />
    <extension name='deltadetection' />
    <extension name='embeddedserver' />
    <extension name='groovynature' />
    <extension name='mediaconversion' />
    <extension name='patches' />
    <extension name='springintegrationlibs' />
    <extension name='tomcatembeddedserver' />
    <extension name='yempty' />
    <extension name='yhacext' />
    <extension name='yvoid' />
    <extension name='promotionenginebackoffice' />
    <extension name='promotionengineservices' />
    <extension name='droolsruleengineservices' />
    <extension name='ordercalculation' />
    <extension name='rulebuilderbackoffice' />
    <extension name='ruledefinitions' />
    <extension name='ruleengine' />
    <extension name='ruleenginebackoffice' />
    <extension name='ruleengineservices' />
    <extension name='kymaintegrationbackoffice' />
    <extension name='kymaintegrationservices' />
    <extension name='backofficesolrsearch' />
    <extension name='solrfacetsearch' />
    <extension name='solrfacetsearchbackoffice' />
    <extension name='solrserver' />
    <extension name='backofficesearchservices' />
    <extension name='searchbackoffice' />
    <extension name='searchprovidercssearchbackoffice' />
    <extension name='searchprovidercssearchservices' />
    <extension name='searchservices' />
    <extension name='selectivecartfacades' />
    <extension name='selectivecartservices' />
    <extension name='cmssmartedit' />
    <extension name='cmssmarteditwebservices' />
    <extension name='smartedit' />
    <extension name='smartedittools' />
    <extension name='smarteditwebservices' />